[
  {
    "model": "qwen-flash",
    "vendor": "alibaba",
    "input_price_usd": 0.05,
    "output_price_usd": 0.4,
    "cache_read_price_usd": null,
    "cache_write_price_usd": null,
    "source_url": "https://www.alibabacloud.com/help/en/model-studio/model-pricing",
    "last_verified": "2026-10-12"
  },
  {
    "model": "qwen-flash-2025-07-28",
    "vendor": "alibaba",
    "input_price_usd": 0.05,
    "output_price_usd": 0.4,
    "cache_read_price_usd": null,
    "cache_write_price_usd": null,
    "source_url": "https://www.alibabacloud.com/help/en/model-studio/model-pricing",
    "last_verified": "2026-10-12"
  },
  {
    "model": "qwen-max",
    "vendor": "alibaba",
    "input_price_usd": 1.6,
    "output_price_usd": 6.4,
    "cache_read_price_usd": null,
    "cache_write_price_usd": null,
    "source_url": "https://www.alibabacloud.com/help/en/model-studio/model-pricing",
    "last_verified": "2026-10-12"
  },
  {
    "model": "qwen-mt-flash",
    "vendor": "alibaba",
    "input_price_usd": 0.16,
    "output_price_usd": 0.49,
    "cache_read_price_usd": null,
    "cache_write_price_usd": null,
    "source_url": "https://www.alibabacloud.com/help/en/model-studio/model-pricing",
    "last_verified": "2026-10-12"
  },
  {
    "model": "qwen-mt-lite",
    "vendor": "alibaba",
    "input_price_usd": 0.12,
    "output_price_usd": 0.36,
    "cache_read_price_usd": null,
    "cache_write_price_usd": null,
    "source_url": "https://www.alibabacloud.com/help/en/model-studio/model-pricing",
    "last_verified": "2026-10-12"
  },
  {
    "model": "qwen-mt-plus",
    "vendor": "alibaba",
    "input_price_usd": 2.46,
    "output_price_usd": 7.37,
    "cache_read_price_usd": null,
    "cache_write_price_usd": null,
    "source_url": "https://www.alibabacloud.com/help/en/model-studio/model-pricing",
    "last_verified": "2026-10-12"
  },
  {
    "model": "qwen-plus",
    "vendor": "alibaba",
    "input_price_usd": 0.4,
    "output_price_usd": 1.2,
    "cache_read_price_usd": null,
    "cache_write_price_usd": null,
    "source_url": "https://www.alibabacloud.com/help/en/model-studio/model-pricing",
    "last_verified": "2026-10-12"
  },
  {
    "model": "qwen-plus-2025-01-25",
    "vendor": "alibaba",
    "input_price_usd": 0.4,
    "output_price_usd": 1.2,
    "cache_read_price_usd": null,
    "cache_write_price_usd": null,
    "source_url": "https://www.alibabacloud.com/help/en/model-studio/model-pricing",
    "last_verified": "2026-10-12"
  },
  {
    "model": "qwen-plus-2025-04-28",
    "vendor": "alibaba",
    "input_price_usd": 0.4,
    "output_price_usd": 1.2,
    "cache_read_price_usd": null,
    "cache_write_price_usd": null,
    "source_url": "https://www.alibabacloud.com/help/en/model-studio/model-pricing",
    "last_verified": "2026-10-12"
  },
  {
    "model": "qwen-plus-2025-07-14",
    "vendor": "alibaba",
    "input_price_usd": 0.4,
    "output_price_usd": 1.2,
    "cache_read_price_usd": null,
    "cache_write_price_usd": null,
    "source_url": "https://www.alibabacloud.com/help/en/model-studio/model-pricing",
    "last_verified": "2026-10-12"
  },
  {
    "model": "qwen-plus-2025-12-01",
    "vendor": "alibaba",
    "input_price_usd": 0.4,
    "output_price_usd": 1.2,
    "cache_read_price_usd": null,
    "cache_write_price_usd": null,
    "source_url": "https://www.alibabacloud.com/help/en/model-studio/model-pricing",
    "last_verified": "2026-10-12"
  },
  {
    "model": "qwen-plus-latest",
    "vendor": "alibaba",
    "input_price_usd": 0.4,
    "output_price_usd": 1.2,
    "cache_read_price_usd": null,
    "cache_write_price_usd": null,
    "source_url": "https://www.alibabacloud.com/help/en/model-studio/model-pricing",
    "last_verified": "2026-10-12"
  },
  {
    "model": "qwen-vl-ocr",
    "vendor": "alibaba",
    "input_price_usd": 0.07,
    "output_price_usd": 0.16,
    "cache_read_price_usd": null,
    "cache_write_price_usd": null,
    "source_url": "https://www.alibabacloud.com/help/en/model-studio/model-pricing",
    "last_verified": "2026-10-12"
  },
  {
    "model": "qwen3-coder-flash",
    "vendor": "alibaba",
    "input_price_usd": 0.3,
    "output_price_usd": 1.5,
    "cache_read_price_usd": null,
    "cache_write_price_usd": null,
    "source_url": "https://www.alibabacloud.com/help/en/model-studio/model-pricing",
    "last_verified": "2026-10-12"
  },
  {
    "model": "qwen3-coder-flash-2025-07-28",
    "vendor": "alibaba",
    "input_price_usd": 0.3,
    "output_price_usd": 1.5,
    "cache_read_price_usd": null,
    "cache_write_price_usd": null,
    "source_url": "https://www.alibabacloud.com/help/en/model-studio/model-pricing",
    "last_verified": "2026-10-12"
  },
  {
    "model": "qwen3-vl-plus",
    "vendor": "alibaba",
    "input_price_usd": 0.2,
    "output_price_usd": 1.6,
    "cache_read_price_usd": null,
    "cache_write_price_usd": null,
    "source_url": "https://www.alibabacloud.com/help/en/model-studio/model-pricing",
    "last_verified": "2026-10-12"
  },
  {
    "model": "qwen3.5-122b-a10b",
    "vendor": "alibaba",
    "input_price_usd": 0.4,
    "output_price_usd": 3.2,
    "cache_read_price_usd": null,
    "cache_write_price_usd": null,
    "source_url": "https://www.alibabacloud.com/help/en/model-studio/model-pricing",
    "last_verified": "2026-10-12"
  },
  {
    "model": "qwen3.5-27b",
    "vendor": "alibaba",
    "input_price_usd": 0.3,
    "output_price_usd": 2.4,
    "cache_read_price_usd": null,
    "cache_write_price_usd": null,
    "source_url": "https://www.alibabacloud.com/help/en/model-studio/model-pricing",
    "last_verified": "2026-10-12"
  },
  {
    "model": "qwen3.5-35b-a3b",
    "vendor": "alibaba",
    "input_price_usd": 0.25,
    "output_price_usd": 2.0,
    "cache_read_price_usd": null,
    "cache_write_price_usd": null,
    "source_url": "https://www.alibabacloud.com/help/en/model-studio/model-pricing",
    "last_verified": "2026-10-12"
  },
  {
    "model": "qwen3.5-397b-a17b",
    "vendor": "alibaba",
    "input_price_usd": 0.6,
    "output_price_usd": 3.6,
    "cache_read_price_usd": null,
    "cache_write_price_usd": null,
    "source_url": "https://www.alibabacloud.com/help/en/model-studio/model-pricing",
    "last_verified": "2026-10-12"
  },
  {
    "model": "qwen3.5-flash",
    "vendor": "alibaba",
    "input_price_usd": 0.1,
    "output_price_usd": 0.4,
    "cache_read_price_usd": null,
    "cache_write_price_usd": null,
    "source_url": "https://www.alibabacloud.com/help/en/model-studio/model-pricing",
    "last_verified": "2026-10-12"
  },
  {
    "model": "qwen3.5-flash-2026-02-23",
    "vendor": "alibaba",
    "input_price_usd": 0.1,
    "output_price_usd": 0.4,
    "cache_read_price_usd": null,
    "cache_write_price_usd": null,
    "source_url": "https://www.alibabacloud.com/help/en/model-studio/model-pricing",
    "last_verified": "2026-10-12"
  },
  {
    "model": "qwen3.5-plus",
    "vendor": "alibaba",
    "input_price_usd": 0.4,
    "output_price_usd": 2.4,
    "cache_read_price_usd": null,
    "cache_write_price_usd": null,
    "source_url": "https://www.alibabacloud.com/help/en/model-studio/model-pricing",
    "last_verified": "2026-10-12"
  },
  {
    "model": "qwen3.5-plus-2026-02-15",
    "vendor": "alibaba",
    "input_price_usd": 0.4,
    "output_price_usd": 2.4,
    "cache_read_price_usd": null,
    "cache_write_price_usd": null,
    "source_url": "https://www.alibabacloud.com/help/en/model-studio/model-pricing",
    "last_verified": "2026-10-12"
  },
  {
    "model": "qwen3.5-plus-2026-04-20",
    "vendor": "alibaba",
    "input_price_usd": 0.4,
    "output_price_usd": 2.4,
    "cache_read_price_usd": null,
    "cache_write_price_usd": null,
    "source_url": "https://www.alibabacloud.com/help/en/model-studio/model-pricing",
    "last_verified": "2026-10-12"
  },
  {
    "model": "qwen3.6-27b",
    "vendor": "alibaba",
    "input_price_usd": 0.6,
    "output_price_usd": 3.6,
    "cache_read_price_usd": null,
    "cache_write_price_usd": null,
    "source_url": "https://www.alibabacloud.com/help/en/model-studio/model-pricing",
    "last_verified": "2026-10-12"
  },
  {
    "model": "qwen3.6-35b-a3b",
    "vendor": "alibaba",
    "input_price_usd": 0.375,
    "output_price_usd": 2.25,
    "cache_read_price_usd": null,
    "cache_write_price_usd": null,
    "source_url": "https://www.alibabacloud.com/help/en/model-studio/model-pricing",
    "last_verified": "2026-10-12"
  },
  {
    "model": "qwen3.6-flash",
    "vendor": "alibaba",
    "input_price_usd": 0.25,
    "output_price_usd": 1.5,
    "cache_read_price_usd": null,
    "cache_write_price_usd": null,
    "source_url": "https://www.alibabacloud.com/help/en/model-studio/model-pricing",
    "last_verified": "2026-10-12"
  },
  {
    "model": "qwen3.6-flash-2026-04-16",
    "vendor": "alibaba",
    "input_price_usd": 0.25,
    "output_price_usd": 1.5,
    "cache_read_price_usd": null,
    "cache_write_price_usd": null,
    "source_url": "https://www.alibabacloud.com/help/en/model-studio/model-pricing",
    "last_verified": "2026-10-12"
  },
  {
    "model": "qwen3.6-plus",
    "vendor": "alibaba",
    "input_price_usd": 0.5,
    "output_price_usd": 3.0,
    "cache_read_price_usd": null,
    "cache_write_price_usd": null,
    "source_url": "https://www.alibabacloud.com/help/en/model-studio/model-pricing",
    "last_verified": "2026-10-12"
  },
  {
    "model": "qwen3.6-plus-2026-04-02",
    "vendor": "alibaba",
    "input_price_usd": 0.5,
    "output_price_usd": 3.0,
    "cache_read_price_usd": null,
    "cache_write_price_usd": null,
    "source_url": "https://www.alibabacloud.com/help/en/model-studio/model-pricing",
    "last_verified": "2026-10-12"
  },
  {
    "model": "qwen3.7-flash",
    "vendor": "alibaba",
    "input_price_usd": 0.03,
    "output_price_usd": 0.13,
    "cache_read_price_usd": null,
    "cache_write_price_usd": null,
    "source_url": "https://www.alibabacloud.com/help/en/model-studio/model-pricing",